{
  "id": "bat",
  "sprites": "bat--snes16",
  "hp": 20,
  "radius": 20,
  "tall": 74,
  "bar": 64,
  "flying": true,
  "hover": 30,
  "bobPx": 5,
  "bobTicks": 90,
  "knockback": { "speed": 300, "decay": { "num": 85, "den": 100 } },
  "coins": 3,
  "bat": {
    "aggro": 500,
    "speed": 240,
    "closeNum": 5,
    "closeDen": 2,
    "everyTicks": 180,
    "range": 420,
    "beyond": 60,
    "swoopSpeed": 520,
    "swoopAlt": 10,
    "swoopAltDiv": 10,
    "hit": 70,
    "stop": 25,
    "dmg": 3,
    "cooldownTicks": 96,
    "retreatSpeed": 300,
    "retreatTicks": 42,
    "retreatAlt": 32,
    "retreatAltDiv": 20,
    "edgePad": 40,
    "hurtPauseTicks": 18
  }
}
